{
  "schema": "asb.ticker/2",
  "rankingVersion": "asb.rank.v2",
  "translation": "bsb",
  "focus": {
    "vid": 19022001,
    "ref": "Ps.22.1",
    "label": "Psalm 22:1"
  },
  "counts": {
    "out": 22,
    "in": 50,
    "unique": 62,
    "shown": 12,
    "more": 50
  },
  "order": "score desc; out/both before in-only; then canonical order (start vid asc)",
  "motion": {
    "mode": "autoScroll",
    "loop": true,
    "baseSeconds": 1.6,
    "perWeightSeconds": 1.2,
    "dwellFormula": "dwellSeconds = 1.6 + 1.2 * weight",
    "advanceOnFocusChange": true
  },
  "items": [
    {
      "rank": 1,
      "to": {
        "start": 40027046,
        "end": 40027046,
        "ref": "Matt.27.46",
        "label": "Matthew 27:46"
      },
      "direction": "both",
      "votesOut": 10,
      "votesIn": 14,
      "score": 17.0,
      "weight": 1.0,
      "tier": "strong",
      "sameBook": false,
      "viaRange": null,
      "snippet": "About the ninth hour Jesus cried out in a loud voice, “Eli, Eli, lema sabachthani?” which means, “My God, My…",
      "why": "Jesus quotes this opening line from the cross. Matthew gives it in Aramaic, 'Eli, Eli, lema sabachthani', and then translates it.",
      "aiStatus": "cached",
      "dwellSeconds": 2.8
    },
    {
      "rank": 2,
      "to": {
        "start": 41015034,
        "end": 41015034,
        "ref": "Mark.15.34",
        "label": "Mark 15:34"
      },
      "direction": "both",
      "votesOut": 12,
      "votesIn": 8,
      "score": 16.0,
      "weight": 0.98,
      "tier": "strong",
      "sameBook": false,
      "viaRange": null,
      "snippet": "At the ninth hour, Jesus cried out in a loud voice, “Eloi, Eloi, lema sabachthani?” which means, “My God, My…",
      "why": "Mark records the same cry from the cross in its Aramaic form, 'Eloi, Eloi', with a translation that matches this verse.",
      "aiStatus": "cached",
      "dwellSeconds": 2.78
    },
    {
      "rank": 3,
      "to": {
        "start": 19022016,
        "end": 19022016,
        "ref": "Ps.22.16",
        "label": "Psalm 22:16"
      },
      "direction": "both",
      "votesOut": 4,
      "votesIn": 3,
      "score": 5.5,
      "weight": 0.648,
      "tier": "solid",
      "sameBook": true,
      "viaRange": null,
      "snippet": "For dogs surround me; a band of evil men encircles me; they have pierced my hands and feet.",
      "why": "The same psalm moves from the cry of abandonment to a scene of being surrounded, with hands and feet pierced. Christians have long read it alongside the crucifixion.",
      "aiStatus": "cached",
      "dwellSeconds": 2.38
    },
    {
      "rank": 4,
      "to": {
        "start": 58005007,
        "end": 58005007,
        "ref": "Heb.5.7",
        "label": "Hebrews 5:7"
      },
      "direction": "both",
      "votesOut": 5,
      "votesIn": 2,
      "score": 5.22,
      "weight": 0.632,
      "tier": "solid",
      "sameBook": false,
      "viaRange": {
        "start": 19022001,
        "end": 19022021,
        "label": "Psalm 22:1–21",
        "span": 21
      },
      "snippet": "During the days of Jesus’ earthly life, He offered up prayers and petitions with loud cries and tears to the…",
      "why": null,
      "aiStatus": "not_generated",
      "dwellSeconds": 2.36
    },
    {
      "rank": 5,
      "to": {
        "start": 18003024,
        "end": 18003024,
        "ref": "Job.3.24",
        "label": "Job 3:24"
      },
      "direction": "both",
      "votesOut": 4,
      "votesIn": 2,
      "score": 4.71,
      "weight": 0.603,
      "tier": "solid",
      "sameBook": false,
      "viaRange": {
        "start": 19022001,
        "end": 19022002,
        "label": "Psalm 22:1–2",
        "span": 2
      },
      "snippet": "I sigh when food is put before me, and my groans pour out like water.",
      "why": null,
      "aiStatus": "not_generated",
      "dwellSeconds": 2.32
    },
    {
      "rank": 6,
      "to": {
        "start": 19038008,
        "end": 19038008,
        "ref": "Ps.38.8",
        "label": "Psalm 38:8"
      },
      "direction": "both",
      "votesOut": 4,
      "votesIn": 2,
      "score": 4.71,
      "weight": 0.603,
      "tier": "solid",
      "sameBook": true,
      "viaRange": {
        "start": 19022001,
        "end": 19022002,
        "label": "Psalm 22:1–2",
        "span": 2
      },
      "snippet": "I am numb and badly crushed; I groan in anguish of heart.",
      "why": null,
      "aiStatus": "not_generated",
      "dwellSeconds": 2.32
    },
    {
      "rank": 7,
      "to": {
        "start": 19010001,
        "end": 19010001,
        "ref": "Ps.10.1",
        "label": "Psalm 10:1"
      },
      "direction": "both",
      "votesOut": 2,
      "votesIn": 5,
      "score": 4.5,
      "weight": 0.59,
      "tier": "solid",
      "sameBook": true,
      "viaRange": null,
      "snippet": "Why, O LORD, do You stand far off? Why do You hide in times of trouble?",
      "why": null,
      "aiStatus": "not_generated",
      "dwellSeconds": 2.31
    },
    {
      "rank": 8,
      "to": {
        "start": 19032003,
        "end": 19032004,
        "ref": "Ps.32.3-Ps.32.4",
        "label": "Psalm 32:3–4"
      },
      "direction": "both",
      "votesOut": 2,
      "votesIn": 3,
      "score": 3.5,
      "weight": 0.52,
      "tier": "light",
      "sameBook": true,
      "viaRange": null,
      "snippet": "When I kept silent, my bones became brittle from my groaning all day long.",
      "why": null,
      "aiStatus": "not_generated",
      "dwellSeconds": 2.22
    },
    {
      "rank": 9,
      "to": {
        "start": 19022011,
        "end": 19022011,
        "ref": "Ps.22.11",
        "label": "Psalm 22:11"
      },
      "direction": "out",
      "votesOut": 3,
      "votesIn": 0,
      "score": 3.0,
      "weight": 0.48,
      "tier": "light",
      "sameBook": true,
      "viaRange": null,
      "snippet": "Be not far from me, for trouble is near and there is no one to help.",
      "why": null,
      "aiStatus": "not_generated",
      "dwellSeconds": 2.18
    },
    {
      "rank": 10,
      "to": {
        "start": 19026009,
        "end": 19026009,
        "ref": "Ps.26.9",
        "label": "Psalm 26:9"
      },
      "direction": "out",
      "votesOut": 3,
      "votesIn": 0,
      "score": 3.0,
      "weight": 0.48,
      "tier": "light",
      "sameBook": true,
      "viaRange": null,
      "snippet": "Do not take my soul away with sinners, or my life with men of bloodshed,",
      "why": null,
      "aiStatus": "not_generated",
      "dwellSeconds": 2.18
    },
    {
      "rank": 11,
      "to": {
        "start": 19042001,
        "end": 19042002,
        "ref": "Ps.42.1-Ps.42.2",
        "label": "Psalm 42:1–2"
      },
      "direction": "out",
      "votesOut": 3,
      "votesIn": 0,
      "score": 3.0,
      "weight": 0.48,
      "tier": "light",
      "sameBook": true,
      "viaRange": null,
      "snippet": "For the choirmaster. A Maskil of the sons of Korah. As the deer pants for streams of water, so my soul longs…",
      "why": null,
      "aiStatus": "not_generated",
      "dwellSeconds": 2.18
    },
    {
      "rank": 12,
      "to": {
        "start": 23059011,
        "end": 23059011,
        "ref": "Isa.59.11",
        "label": "Isaiah 59:11"
      },
      "direction": "out",
      "votesOut": 3,
      "votesIn": 0,
      "score": 3.0,
      "weight": 0.48,
      "tier": "light",
      "sameBook": false,
      "viaRange": null,
      "snippet": "We all growl like bears and moan like doves. We hope for justice, but find none, for salvation, but it is far…",
      "why": null,
      "aiStatus": "not_generated",
      "dwellSeconds": 2.18
    }
  ],
  "attribution": "Cross references from OpenBible.info, CC-BY (2016-02-01). Text: Berean Standard Bible, public domain."
}
